offer_id,title,address,district,price,total_area,rooms,floor,floors_total,house_type,year_built,description,link
313114238,"2-комн. квартира, 61,4 м², 2/23 этаж",Москва,СВАО,34 467 340 ₽,61.4,2,2,23,,,"Готовые дома и ключи в день покупки Рассрочка 0% Продаётся 2-комнатная квартира площадью 61.4 м² на 2 этаже в Жилом Комплексе ""Союз"". Квартал здоровой жизни премиум-класса с рекордным количеством олимпийских видов спорта: - Ледовая арена для хоккея и фигурного катания, - Футбольные поля для тренировок, - Спортивный зал для фехтования, - Бассейн на 6 дорожек, - Центр единоборств, - 4 крытых площадки для настольного тенниса, - 7 теннисных кортов (крытых и открытых), - 4 крытых площадки для сквоша, - Легкоатлетический стадион, - Площадки для баскетбола и волейбола. Уникальные форматы квартир с мастер-спальнями, приватными террасами, балконами, а также пентхаусы с открыточными видами на город. Все квартиры продаются с отделкой Shell&Core и панорамным остеклением. Расположение Пешком: - 2 мин. до парка ""Сад Будущего""; - 6 мин. до ст. м. """"Ботанический сад""""; - 6 мин. до ст. МЦК """"Ботанический сад """"; - 6 мин. до парка ""Леоновская роща""; На автомобиле: - 2 мин. до СВХ (МСД); - 5 мин. до Проспекта Мира; - 10 мин. до ТТК; - 15 мин. до Садового кольца; - 25 мин. до аэропорта """"Шереметьево"""". Благоустройство - собственная спортивная инфраструктура 7 Га; - зона для пикников; - игровые и спортивные площадки для детей всех возрастов; - розарий, а также сосновые, каштановые и дубовые аллеи; - площадки под открытым небом для занятий спортом и йоги; - игровые комнаты для детей; - лаунж-зона для резидентов; - просторная переговорная для деловых встреч; - премиальный ресторан ""Шабада"" Сосо Павлиашвили с водными арт-объектами на прогулочной аллее, садом ароматных трав и сценой под открытым небом; - кафе, химчистки, аптеки и супермаркеты рядом с домом. Окружение - 8 парков: Сад Будущего, Леоновская роща, Хуамин, Главный ботанический сад РАН, Шереметьевская дубрава, Останкино, парк спорта ""Яуза"", пойма реки Яуза и музей-усадьба ""Останкино""; - 3 ВУЗа: ВГИК, РГСУ, МГПУ; - 12 школ, в том числе: школа 1499 им. И.А. Докукина (топ 100), Brookes Moscow, IThub школа; - 18 детских садов, в том числе билингвальный ALERTUM KIDS; - один из крупнейших океанариумов Европы ""Москвариум""; - один из крупнейших в Европе торгово-развлекательных центров ""Европолис"".",https://www.cian.ru/sale/flat/313114238/
318385656,видовая квартира,Москва,ЦАО,80 000 000 ₽,,,,,,,,https://www.cian.ru/sale/flat/318385656/
322851157,"2-комн. квартира, 72,1 м², 38/90 этаж",Москва,ЦАО,80 456 390 ₽,72.1,2,38,90,,,"Старт продаж! Квартиры в Москва-Сити в самой инновационной башне One. В продаже 2-комнатная квартира площадью 72.10 м² на 38-м этаже. Новый современный жилой комплекс премиум-класса One расположен в самом сердце деловой жизни столицы — в Москва-Сити, где захватывающая дух архитектура встречается с безупречным уровнем комфорта. One находится в Пресненском районе, в пешей доступности от станции метро ""Деловой центр"". Проект был разработан выдающимся архитектором Сергеем Кузнецовым при участии международного бюро Gensler. Уникальная скульптурная форма башни, вдохновленная лентой Мебиуса, создает новый узнаваемый силуэт делового центра и задает непревзойденный стандарт вертикальной жизни. По замыслу архитекторов, жилой комплекс представляет собой две вертикальные башни, соединенные в нижней и верхней точках. На 85 этаже расположен Sky Garden — самый высокий в Европе парк с оазисом природы и секретным садом в облаках, а на 83 этаже парит стеклянный мост Sky Bridge с панорамными видами. Важнейшей особенностью комплекса является его всесторонняя инфраструктура по принципу All-in-One: закрытый клуб с лаунжами, приватным кинотеатром, бильярдной, рабочими зонами и фитнесом. Здесь же расположена торговая галерея бутиков и премиальный гастро-кластер, концепцию которого разработал известный ресторатор Александр Сысоев. Особенности комплекса: - Эксклюзивная архитектура от главного архитектора Москвы - Самый высокий в Европе небесный сад Sky Garden на 85 этаже - Панорамное остекление от пола до потолка во всех квартирах - Smart-инженерия и сервис уровня пятизвездочного отеля - Приватная клубная инфраструктура All-in-One - Трехуровневый паркинг с зарядными станциями для электрокаров - Круглосуточная безопасность и консьерж-сервис Расположение комплекса: - Пешая доступность от станции метро ""Деловой центр"" - 2 минуты до Экспоцентра - 5 минут до Дома Правительства - 7 минут до Кутузовского проспекта",https://www.cian.ru/sale/flat/322851157/
320695724,Дизайнерский ремонт | Есть Лифт,Москва,ЦАО,89 000 000 ₽,,,,,,,"ЭЛИТНАЯ КВАРТИРА В САМОМ ЦЕНТРЕ МОСКВЫ Продается уникальная квартира на Петровке — в одном из самых престижных районов столицы. Основные преимущества: Лифт в доме редкость для исторической застройки. Закрытая парковка за шлагбаумом удобство и безопасность. Консьерж и комфортные соседи. О квартире: Узаконенная планировка: Просторная кухня-гостиная Мастер-спальня с собственной ванной комнатой Две изолированные детские комнаты Гардеробная Два совмещенных санузла Ремонт выполнен из премиальных материалов с продуманным дизайном. Полностью укомплектована встроенной техникой ведущих брендов. Современные технологии: теплые полы, система видеонаблюдения с удаленным доступом. Что делает этот объект особенным? Историческая локация — улица с богатым прошлым, где жили Чехов, Пушкин, Есенин. Культурный центр Москвы — в пешей доступности Большой театр, Петровский пассаж, лучшие рестораны, галереи и бутики. Уникальная архитектура — здание 1908 года, сочетающее стиль и современные удобства. Прямой выход из двора в Столешников переулок. Идеальная локация: 15 минут пешком до Красной площади и Александровского сада. 25 минут пешком до Патриарших прудов. Вокруг лучшие рестораны, фитнес-клубы, частные школы. Звоните, чтобы узнать подробности и договориться о просмотре!",https://www.cian.ru/sale/flat/320695724/
323128703,"2-комн. квартира, 50,4 м², 4/12 этаж",Москва,ВАО,29 836 800 ₽,50.4,2,4,12,,,"ARTEL два 12-этажных клубных дома по 82 квартиры в каждом. Квартира без отделки. Доступна опция дозаказа (2 варианта отделки на выбор). Особенности: Консьерж-сервис премиального уровня: ваших гостей встретят и проводят, помогут с бытовыми вопросами. Профессиональные службы клининга и охраны обеспечат полный порядок. На ухоженной, безопасной территории комплекса вы не увидите никого кроме соседей. Доступна опция валет-паркинга. Инфраструктура: 58 машиномест в подземном паркинге. Каждое — с зарядкой для электромобиля. Есть мотоместа. Предусмотрено хранение велосипедов и самокатов, колясочные и лапомойки. В приватном атриумном дворе сад с дорожками из натурального камня, воркаут-зона, места для отдыха и работы. Отдельная парковка для курьеров. Для курьеров будет отдельный вход, чтобы не пересекаться с остальными жильцами. Вокруг комплекса много зелени, низкая плотность и этажность окружающей застройки. Новых строек рядом не предвидится. В шаговой доступности: 10 детских садов и 8 школ, Преображенская набережная, кафе и рестораны, ТЦ, музеи, медицинская и спортивная инфраструктура. Сделка по договору долевого участия.",https://www.cian.ru/sale/flat/323128703/
321358647,"Квартира ""под ключ"" на Петровке",Москва,ЦАО,89 000 000 ₽,,,,,,,"ID 64740. Предлагается четырехкомнатная квартира в самом центре столицы. Дом 1908 года с лифтом, перекрытия смешанные. В квартире выполнен качественный ремонт в 2021 году. Полностью новая мебель и бытовая техника. В каждой комнате кондиционер. Узаконенная перепланировка. Просторная студия и плюс 3 изолированные комнаты. Хозяйская спальня со своим санузлом. Дополнительный санузел с душевой кабиной на две детские комнаты. Просторная прихожая, гардеробная комната. Современные технологии: теплые полы, система видеонаблюдения с удаленным доступом. Два парковочных места за шлагбаумом на огороженной территории. В подъезде круглосуточно работает консьерж. Прямой выход из двора на Столешников переулок третью по стоимости торговую улицу в мире! Локация мечты: Красная площадь и Александровский сад 15 минут пешком. Чистые и Патриаршие пруды 25 минут. В пешей доступности бутики элитные рестораны, школы, фитнес-клубы, включая бассейн. 10 минут пешком Большой Театр, ЦУМ, Петровский пассаж, Сандуновские бани, театры, музеи. ПРЯМОЙ ПРЕДСТАВИТЕЛЬ СОБСТВЕННИКА. БОНУС АГЕНТУ. ОПЕРАТИВНЫЙ ПОКАЗ. БЕЗ КОМИССИИ ДЛЯ ПОКУПАТЕЛЯ. Intermark Real Estate - участник ассоциации AREA. Брокер объекта Трипольская Екатерина . Мы работаем в выходные и праздничные дни, будем рады вашим звонкам в любое время.",https://www.cian.ru/sale/flat/321358647/
307211222,Скидка 15% на лоты с отделкой,Москва,ЦАО,,,,,,,,"Продаются апартаменты с сервисом 5* отеля на 8-м этаже общей площадью 57.6 метров с 1-й спальней и кухней-гостиной. Дом готов. О жилом комплексе Исключительный проект на главной улице Москвы, меняющий эстетику жизни в современном мегаполисе. Компания Vesper представляет проект на Тверской — апартаменты класса de luxe с отделкой и мебелью, с сервисом и инфраструктурой. Проект Vesper Tverskaya завершает архитектурный ансамбль Тверской, занимая последний свободный участок главной улицы города — в самом центре культурной, деловой и ночной жизни Москвы. Два здания, в которых расположены апартаменты, создают единый ансамбль. Они соединены общими этажами, где расположены wellness-клуб с бассейном и СПА и паркинг. При этом у каждого из зданий отдельный вход. О застройщике Девелопер проекта Vesper специализируется в премиальном сегменте клубной жилой недвижимости. Портфель компании включает в себя 22 проекта в Москве и странах Европы. Актуальные архитектурные проекты, индивидуальный дизайн, передовые технологии, качественные материалы и лучшие мировые практики воплощены в каждом доме компании. Расположение и транспортная доступность Расположение в самом центре, на Тверской улице, создает особый ритм жизни. Всё, чем может заинтересовать один из крупнейших мегаполисов мира, располагается прямо перед вашими окнами.Всего в паре шагов — Патриаршие пруды, один из самых модных и концептуальных районов города. Гастрономические рестораны и энотеки, театры, музеи, лучшие школы — формируют идеальную среду для проживания в мегаполисе. Из апартаментов открываются панорамные виды на динамичную главную улицу города, Триумфальную площадь, исторические особняки. Архитектура Здания, проект которых разработан архитектурным бюро SPEECH под руководством Сергея Чобана, виртуозно балансируют между классической и новаторской концепциями. Проект органично вписывается в элегантный ряд исторических зданий Тверской, привнося свежий акцент своей современной интерпретацией классических форм и пропорций. Все апартаменты предлагаются с высококачественной отделкой с использованием мрамора, дерева ценных пород и текстиля, включающей оборудованные кухни и ванные комнаты. Дом оснащен многоуровневой системой очистки воды, централизованной системой кондиционирования и повышенной шумоизоляцией окон. Инфраструктура Wellness-клуб с 20 метровым бассейном, фитнес центр и СПА, просторные lounge-зоны — все эти преимущества доступны владельцам апартаментов. Доставить ужин из ресторана к приходу гостей или сделать уборку дома к возвращению из командировки — все это можно доверить сервису Vesper Tverskaya, не сомневаясь в качестве результата. Сервисы: -Консьерж-сервис 24/7 -Портье -Услуги горничной -Техническое обслуживание апартаментов Техническое оснащение дома: -Инновационная система микроклимата TION -Увлажнение воздуха, система центрального кондиционирования типа VRF -Многоуровневая система очистки воды -Бесперебойное обеспечени",https://www.cian.ru/sale/flat/307211222/
323161110,Клубный дом! Заезжай и Живи!,Москва,ЦАО,105 000 000 ₽,,,,,,,"Предлагаем Вашему вниманию 4 комнатную квартиру в пешей доступности от нескольких станций метро: ""Белорусская""/ ""Маяковская"". Клубный дом на 20 квартир. Закрытая охраняемая территория. Консьерж. Планировка: Холл, кухня -гостиная, 3 изолированные комнаты, 2 санузла,лоджия. Окна выходят на две стороны. Интеллигентные соседи! Свободная продажа! Взрослый собственник на основании ДКП. М/М в подземном паркинге.",https://www.cian.ru/sale/flat/323161110/
322365120,"2-комн. апартаменты, 71,8 м², 8/17 этаж",Москва,ЗАО,,71.8,2,8,17,,,"Успейте приобрести по выгодным условиям! AHEAD - проект премиум-класса на Кутузовском проспекте. Исключительная локация в престижном Западном округе в 10 минутах ходьбы от парков Победы и Фили, а также двух станций метро, и в 15 мин на автомобиле до ""Москва-Сити"" и Садового кольца. Рядом фитнес-клубы, волейбольная арена ""Динамо"", Европейская школа тенниса. Динамичная архитектура от бюро ""Цимайло Ляшенко и Партнеры"" подчеркивает статус, как и открывающиеся из окон резиденций панорамные виды на Поклонную и Воробьёвы горы, Филёвский парк или ""Москва-Сити"". Всего 73 резиденции и 4 пентхауса с дровяными каминами. Остались последние лоты с уникальными планировками! Все апартаменты продаются с отделкой White Box. При покупке ряда апартаментов владелец получает в качестве бонуса готовый дизайн-проект с рабочей документацией от известной студии дизайна BALCON, что в разы ускорит и упростит процесс превращения ""белого листа"" в продуманное и комфортное пространство для жизни. С окнами Schco в алюминиевом профиле можно не только беспрепятственно созерцать городской ландшафт, но и быть уверенными в том, что уличный шум не проникнет в дом. Особенным местом для досуга станет собственная открытая терраса на 7 этаже с лаундж-зоной и видами на Парк Победы и Воробьевы горы: - Workout для тренировок на свежем воздухе. - Зал йоги для индивидуальных тренировок или мини-групп. - Удобное пространство для работы и деловых переговоров. - Приватный двор с водопадом, прудом и хвойными деревьями редких пород. Инженерное оснащение выполнено с учетом современных технологических решений: - Централизованная система кондиционирования VRF c возможностью регулировки температурного режима в каждом помещении - Скрытые бесшумные воздуховоды - Качественная звукоизоляция: внутрипольные конвекторы, двухкамерные стеклопакеты Schuco с алюминиевым профилем, стекла покрыты светоотражающим напылением - Круглогодичная горячая вода - Биометрический контроль доступа - Видеонаблюдение территории и видеодомофон - Система автоматического распознавания авто номеров - Приточная вентиляция (свежий чистый воздух)",https://www.cian.ru/sale/flat/322365120/
