offer_id,title,address,district,price,total_area,rooms,floor,floors_total,house_type,year_built,description,link
321869586,Своя квартира от 120 000 ₽/мес,Москва,ЮАО,20 933 220 ₽,,,,,,,"Рассрочка 0% с платежом от 120 000 ₽ в месяц. 1-комн. квартира в ЖК ""Twelve"" на 4 этаже в 28 этажном здании Корпус 3. Общая площадь: 39.4 кв.м., жилая: 13.10 кв.м. Высота потолков 3.00 м. ЖК Twelve от застройщика Tekta Group — это новый уровень жизни в районе Нагорный в 3-х минутах от станции метро. Проект представляет собой воплощение современной концепции комфортной жизни, где функциональность органично сочетается с эстетикой. Архитектура Twelve создает атмосферу, вдохновляющую на успех и располагающую к позитивным эмоциям. Дом, в котором каждый день будет наполнен уютом, а не рутинной работой и дорожными пробками. Twelve предлагает своим жильцам продуманные планировки, возможность объединения квартир, а также увидеть красоту города через угловое остекление увеличенных окон. Особое внимание уделено комфорту жителей: благоустроенная территория, зеленые насаждения, детские площадки, парковка. ЖК Twelve — это больше, чем просто жилье: это атмосфера умиротворенности, комфорта и гармонии.",https://www.cian.ru/sale/flat/321869586/
321616847,"Вид во двор и на реку, 3 спальни!",Москва,ЦАО,70 000 000 ₽,,,,,,,"Продается великолепная 3-комнатная квартира с евроремонтом в современном доме на Шмитовском проезде, 39к8. Общая площадь — 108 кв. м, жилая площадь — 64 кв. м, кухня — просторные 32 кв. м. Квартира находится на 17 этаже 18-этажного монолитного дома, построенного в 2023 году. Высота потолков — 3 метра, что создает ощущение простора и воздуха. В квартире выполнен качественный евроремонт. Планировка включает две совмещенные ванные комнаты и один отдельный санузел, что удобно для большой семьи. Окна выходят во двор, поэтому в квартире тихо и уютно. Просторная кухня позволяет комфортно проводить время всей семьей, готовя и устраивая званые ужины. Дом оборудован тремя пассажирскими и четырьмя грузовыми лифтами, что обеспечивает быстрый доступ к квартире даже в часы пик. Для вашего удобства предусмотрена подземная парковка. Также в доме есть мусоропровод, что делает жизнь еще более комфортной. В шаговой доступности от дома находятся школы, детские сады и магазины — все необходимое для жизни и воспитания детей. До метро ""Шелепиха"" всего 8 минут пешком, что позволит вам легко и быстро добраться до центра города. Квартира продается без обременений, возможна ипотека. Все документы готовы к сделке. Не упустите возможность стать обладателем этой удивительной квартиры. Записывайтесь на просмотр и убедитесь сами в ее уникальности!",https://www.cian.ru/sale/flat/321616847/
322873462,Инвестиция в семейные ценности!,Москва,ЦАО,650 000 000 ₽,,,,,,,"Предлагается к продаже видовая 4-комнатная квартира в современном жилом комплексе Садовые кварталы. В квартире выполнена премиальная дизайнерская отделка с использованием высококачественных и натуральных материалов, таких как: натуральный мрамор, анодированная бронза, натуральный итальянский шпон, анодированная латунь. Квартира укомплектована техникой и мебелью: Кухня производство Poliform Italy; Паркет - производство Foglio d Oro Italy; встроенная мебель в квартире выполнены из натурального шпона -Spessart oak (копченый дуб ) - самый дорогой и стильный вид обработки дерева; в отделке квартиры использованы анодированная латунь, мрамор и кварцит производства Italy, бронзовые зеркала; - Мебель - Poliform ,Minotti, Poltrona Fray, Rimadezio; - Техника: Miele, Vzug; - Сантехника и мебель в ванных Gessi ,Antonio Luppi ,Arby; - Гардеробные и кухня производства Italy Poliform; Дополнительно: - двери скрытого монтажа Lualdy Italy: короб выполнен из анодированной бронзы, фасады из матового стекла, шпона или бронзового зеркала в зависимости от помещения; - напольные покрытия - паркет Foglio di Oro Italy, мрамор; - текстиль - ручной пошив, двойные, лицевая сторона -Dedar, подкладочная ткань Dimout -Belgia, 100% поглощение света как в кинотеатре, электро открывание и закрывание - пульт ,выключатель, либо ручное или от прикосновения; - выключатели Buster + punch / london; - картины и искусство Artmoscow. ТЕХНИЧЕСКИЕ ХАРАКТЕРИСТИКИ - индивидуальное кондиционирование Daikin; - форсуночная система увлажнения Universe; - общедомовая система приточно-вытяжной вентиляции; - система защиты от протечек Neptun; - шумоизоляция по периметру всей квартиры (пол, стены, потолок). Квартира расположена в тихом квартале на высоком этаже жилого комплекса, что даёт возможность находится в эпицентре событий района Хамовники, но наслаждаться камерностью так, как на этаже по две квартиры. Видовые характеристики: открытый вид на центр города, москва Сити, Лужники. Правильное планировочное решение по зонам: Зона 1: - Кухня гостиная с обеденной зоной; - постирочная; - гостевой санузел; - гардеробная комната при входе; - холл. Зона 2: мастер-спальня со своим санузлом (душевая) и гардеробной комнатой; - спальня со своим санузлом (ванна) и гардеробной комнатой; - мастер спальня со своим санузлом (душевая) с системой хранения и рабочим местом. Инфраструктура района развита: рядом находятся лучшие школы, детские сады, клиники и магазины, рестораны, прогулочные зоны, пруд - все необходимое для комфортной жизни находится в шаговой доступности, что значительно экономит ваше время. Марина Шанцева, брокер ответственный за продажу данного объекта, готова ответить на все ваши вопросы и помочь в осуществлении вашей мечты о новой квартире!",https://www.cian.ru/sale/flat/322873462/
320397183,"1-комн. квартира, 35,76 м², 2/24 этаж",Москва,СВАО,,35.76,1,2,24,,,"Прямая продажа от застройщика. Продаётся 1-комнатная квартира общей площадью 35.76 м² без отделки в доме премиум-класса МИRА на 2-м этаже 24 этажного дома. Квартира расположена в корпусе 3. Дом премиум-класса МИRA это: • Спокойный район с богатой историей и сложившейся инфраструктурой • Авторская архитектура на стыке классики и современности • Вход в парк прямо из жилого комплекса • Панорамные виды на Яузу, парки, ВДНХ и скульптуру ""Рабочий и колхозница"" • Удобные сервисы и безопасность для каждого резидента Расположение: Жилой квартал расположен в Алексеевском районе на северо-востоке Москвы, на второй линии домов, таким образом вы сможете дистанцироваться от шума и суеты проспекта Мира, но при этом будете жить недалеко от этой важной городской магистрали. Прямо у дома: • Парк Акведук • Река Яуза • Памятник ""Рабочий и колхозница"" Пешком: • 16 мин м. ВДНХ На автомобиле: • 12 мин ТТК • 15 мин Садовое кольцо • 12 мин Национальный парк ""Лосиный остров"" Благоустройство: Концепция благоустройства от бюро ""ДРУЖБА"" разработана в стиле ""Лесная тропа"". В уютном дворе расположились словно затерянные в лесу, площадки для отдыха. Они разделяются островками с травами, кустарниками, крупными камнями и деревьями, между которыми проходят узкие песчаные тропинки с деликатной подсветкой по вечерам. Центральной точкой притяжения для жителей станет главная площадь с фонтаном, которая открывается сразу из двух входных групп. Внутренний двор МИRA: • Детская площадка с зонами для игр малышей до трех лет и детей более старшего возраста • Спортивная площадка с профессиональным оборудованием для тренировок • Декоративные перголы • Воздушный арт-объект с подсветкой, похожий на облако • Чайный домик, где в отдельном отапливаемом павильоне можно в любое время года попить кофе с соседями или устроить камерное семейное чаепитие • Зоны для работы и отдыха с гамаком под навесом, скамейками и креслами Инфраструктура и окружение: В Алексеевском районе есть огромные благоустроенные парки, магазины, гимназии с высоким рейтингом и филиалы ВУЗов, частные и государственные детские сады, модные кофейни и фитнес-центры. В квартале МИRА предусмотрены: • 2 ресторана с видом на парк Акведук • 3 кафе • фитнес-студия • подземный паркинг на 330 машино-мест Компания MR Group предлагает своим клиентам специальные условия приобретения квартир в рамках программ ипотечного кредитования от банков-партнеров.",https://www.cian.ru/sale/flat/320397183/
321395247,Золотая миля,Москва,ЦАО,430 000 000 ₽,,,,,,,"Лот 1000152. Евгения Валуева. Эксклюзив подписан. ЖК ""Виктория"". Предлагается современная 4-х комнатная квартира в клубном доме, Пожарский пер 5А. Функциональная планировка: уютная гостиная, многофункциональная кухня/столовая, полностью укомплектована встроенной бытовой техникой; 3 просторных спальни с собственным с/у, камин, постирочная, 2 балкона, гостевой с/у, прихожая. В квартире выполнена отделка в светлых тонах. Высокие потолки 3.1, большое количество окон. Имеется подземный паркинг. В наличии 2 м/м. Территория дома огорожена и охраняема. Клубный дом выполнен в традиция архитектуры стиля модерн. Разработкой проекта занимался авторский коллектив архитектурной мастерской Павла Андреева. Развитая инфраструктура, удобная транспортная доступность. Свободная продажа, 1 взрослый собственник более 10 лет, никто не прописан. Бонус партнерам 50%. Есть презентации в pdf на русском или английском для партнеров. Член ассоциации агентств элитной недвижимости AREA.",https://www.cian.ru/sale/flat/321395247/
322756380,Лучший корпус в жилом квартале,Москва,ЦАО,360 000 000 ₽,,,,,,,"ID 64709. Эксклюзивно в компании INTERMARK. ЖК Садовые Кварталы. Экслюзивно в компании INTERMARK! Новое предложение в легендарном ЖК Садовые Кварталы в Хамовниках невероятно атмосферная, эстетичная четырехкомнатная квартира с мебелью и бытовой техникой. Планировка: большая зона кухни-гостиной, хозяйская спальня с с/у, 2 спальни с выходами на собственные балконы, дополнительная ванная комната, гостевой с/у, постирочная. Интерьер квартиры выдержан в эффектном стиле ""фьюжн"": натуральные фактуры, сочные контрастные и мягкие нежные оттенки, яркие предметы декора создают уютное и стильное жилое пространство, где так приятно находиться. Высокие потолки в 3.5 метра добавляют ощущение простора и света. В квартире предусмотрены функциональные, вместительные системы хранения. Великолепную инсоляцию создают панорамные окна, ориентированные на 3 стороны света. Стильные лобби с зонами ожидания, подземный паркинг, ландшафтная внутренняя территория со спортивными и детскими площадками. Концепция ""город в городе"" включает все для максимально комфортного семейного проживания: детский сад, фитнес-клуб, пекарни, рестораны. В центральной части квартала расположен пруд с благоустроенной зоной для прогулок и отдыха. В пешей доступности - исчерпывающая инфраструктура района Хамовники. ПРЯМОЙ ПРЕДСТАВИТЕЛЬ СОБСТВЕННИКА. БОНУС АГЕНТУ. ОПЕРАТИВНЫЙ ПОКАЗ. БЕЗ КОМИССИИ ДЛЯ ПОКУПАТЕЛЯ. Intermark Real Estate - участник ассоциации AREA. Брокер объекта Колобашкина Елизавета. Мы работаем в выходные и праздничные дни, будем рады вашим звонкам в любое время.",https://www.cian.ru/sale/flat/322756380/
306541543,Семейные квартиры премиум-класса,Москва,ЦАО,390 424 228 ₽,,,,,,,"Продаётся 4 - комнатная квартира в готовом доме (Корпус 4.1), общей площадью 234.3 кв.м., на 18 этаже. Квартира сдается с премиальной отделкой, включающей оборудованную кухню и ванные комнаты. О жилом комлексе Жилой квартал Lucky - это переосмысление и регенерация общественно-делового кластера площадью более 4.5 гектаров в центре Москвы. О застройщике Девелопер проекта Vesper специализируется в премиальном сегменте клубной жилой недвижимости. Портфель компании включает 22 проекта в Москве и странах Европы. Актуальные архитектурные проекты, индивидуальный дизайн, передовые технологии, качественные материалы и лучшие мировые практики воплощены в каждом доме компании. Расположение и транспортная доступность Квартал расположен на пересечении улиц 2-ая Звенигородская и Костикова, в 200 метрах от метро ""Улица 1905 года"". В непосредственной близости от парков, Москвы- реки, Сити и Садового кольца формируется идеальная среда для семейного проживания в мегаполисе. Архитектура Визуально квартал разделен на две части: верхний город с новыми высотными жилыми домами и нижний город с общественным пространством для инфраструктуры, где будет располагаться новый социокультурный кластер площадью около 10 000 кв. м. Верхний город будет состоять из восьми жилых домов: семь 21-этажных башен и одно здание высотой 15 этажей. В восьми новых домах расположены 618 квартир. На каждом этаже 3-4 квартиры, большая часть которых имеет ориентацию на 2-3 стороны света. Из панорамных окон открываются виды на набережную Москва-реки, Сити и близлежащие парки. Знаковая архитектура, продуманные планировочные решения, изысканная отделка, инновационные инженерные решения воплощены в квартале Lucky. Инфраструктура В квартале представлена инфраструктура для всей семьи: парки и скверы, билингвальный детский сад La Berezka, собственный 600 м. игровой парк для детей, фитнес с подогреваемым бассейном на крыше, рестораны, кафе и магазины органических продуктов. В шаговой доступности от квартала расположены лучшие рейтинговые школы.",https://www.cian.ru/sale/flat/306541543/
322917971,Рядом с Кремлем!,Москва,ЦАО,350 000 000 ₽,,,,,,,"ID: 585570 Роскошная 3-комнатная квартира общей площадью 190 кв.м. в клубном комплексе ""Green Plaza"", расположенном в пешей доступности от Кремля, в одном из самых живописных мест исторического центра Москвы. Здесь царит атмосфера тишины, уюта и по-настоящему столичного лоска, а до знаковых культурных мест — всего несколько минут пешком. Интерьер квартиры оформлен в духе сдержанной элегантности: классические формы, натуральные материалы, мрамор, ценные породы дерева, лепнина ручной работы и благородные декоративные акценты создают атмосферу изящной роскоши. Функциональное планировочное решение: просторная и светлая гостиная с зонами столовой и кухни, мастер-спальня с санузлом, вторая спальня с санузлом, гостевой санузел, большой холл с продуманной системой освещения, встроенными системами хранения и изысканными декоративными акцентами, создающими ощущение уюта и гармонии. Панорамные окна наполняют пространство светом и открывают великолепные виды на историческую Москву. Высокие потолки создают атмосферу легкости и простора. В клубном доме ""Green Plaza"" всего 28 резиденций, что обеспечивает уединённость и приватность. Презентабельная входная группа. Круглосуточная охрана. Для комфорта владельцев предусмотрены два машино-места в подземном паркинге. Идеальный выбор для тех, кто ценит тишину центра, эстетику архитектуры, удобство городской жизни и близость к лучшему, что может предложить Москва — от Консерватории и театров до уютных ресторанов и престижных школ. Участник ассоциации AREA. Номер объекта: #1/585570/14501",https://www.cian.ru/sale/flat/322917971/
